{
  "schema_version": "1.0",
  "save_point_id": "44444444-4444-4444-8444-444444444444",
  "run_id": "11111111-1111-4111-8111-111111111111",
  "turn_id": "turn-2",
  "created_at": "2026-08-16T11:50:00Z",
  "last_event_id": "22222222-2222-4222-8222-222222222222",
  "last_event_offset": 3,
  "last_event_hash": "aaaaaaaaaaaaaaaaaaaaaaaaaaaaaaaaaaaaaaaaaaaaaaaaaaaaaaaaaaaaaaaa",
  "status": "complete",
  "turn_snapshot": {
    "ref": "memory/runs/11111111-1111-4111-8111-111111111111/turns/turn-2/snapshot.json",
    "sha256": "dddddddddddddddddddddddddddddddddddddddddddddddddddddddddddddddd"
  },
  "context_manifest": {
    "ref": "memory/runs/11111111-1111-4111-8111-111111111111/turns/turn-2/context-manifest.json",
    "sha256": "eeeeeeeeeeeeeeeeeeeeeeeeeeeeeeeeeeeeeeeeeeeeeeeeeeeeeeeeeeeeeeee",
    "context_signature": "ffffffffffffffffffffffffffffffffffffffffffffffffffffffffffffffff"
  },
  "artifacts": [
    {
      "ref": "memory/control/measurement-1.json",
      "sha256": "cccccccccccccccccccccccccccccccccccccccccccccccccccccccccccccccc",
      "validator": "validate-control-artifact",
      "validation_status": "valid"
    }
  ],
  "registry_offsets": {
    "entities": null,
    "creators": null,
    "claims": null,
    "consent": null,
    "launches": null,
    "channels": null,
    "narrative": null
  },
  "visited_skills": [
    "ad-creative-builder",
    "paid-measurement-loop"
  ],
  "chain_depth": 1,
  "pending_handoff": {
    "status": "proposed",
    "objective_code": "readback",
    "recommended_skill": "roi-calculator"
  },
  "next_action": {
    "code": "review-cycle-retro"
  }
}
